The Governance Committee supports the Board in fulfilling its role by approving the publication of our annual ESG report, reviewing our progress and performance against our ESG targets, and reviewing periodic reports related to developments, trends, best practices, risks and issues related to our ESG targets and reporting.
SOCIAL GOVERNANCE TCFD APPENDICES ESG GOVERNANCE Board of Directors D D Governance Committee OVERSIGHT Reports ESG performance and progress Executive Team MANAGEMENT Reports ESG performance and progress ESG Working Group Includes representatives across the organization with the following experience: – Sustainability – Shareholder – Communications Relations – Governance – Marketing – Legal – Operations – Safety – – Environment – Supply Chain – Treasury – Customer – Finance – IT – Risk – Compliance – Community Human Resources Relations – Public Policy – Audit < > 55 ENMAX 2021 ENVIRONMENTAL, SOCIAL & GOVERNANCE REPORT ESG SCORECARD ABOUT ENMAX ENVIRONMENT SOCIAL GOVERNANCE TCFD APPENDICES CEO LETTER Management's role To support the implementation of our plans and the achievement of our targets, our executive team and subject matter experts are involved in the management of ESG issues in the following ways: EXECUTIVE TEAM'S ROLE ENMAX's executive team is responsible for the management of our ESG commitments.
The executive team regularly reports to both the Governance Committee and Board on ESG and climate-related matters.
Read more in the Task Force on Climate- related Financial Disclosures (TCFD) section of this report.
For 2022, we have embedded several performance measures related to our ESG targets into our Long-Term Incentive Plan (LTIP), a three-year plan for ENMAX's senior leaders.
We have integrated key ESG factors into our executive compensation strategies as success in these areas is critical to ENMAX's long-term success and sustainability.
ESG WORKING GROUP In 2020, we formed an ESG Working Group with people from across the organization.
The role of the group is to advance and communicate progress towards our ESG targets.
It is chaired by ENMAX's Director of ESG Performance and Reporting and discusses and drives organizational progress on our ESG targets.
For 2022, we have embedded several performance measures related to our ESG targets into our Long-Term Incentive Plan for leaders (directors and above).
Safety and environmental management systems In order to support the execution of our policies and practices, we have mature management systems, clear data collection and reporting, and strong internal structures to effectively manage our safety and environmental risks, including that: - We follow the Alberta Safety Codes Act, which governs public safety, and we also report any instances of employee, contractor or public electrical contacts.
- All work carried out in Alberta is in accordance with Alberta's Occupational Health and Safety Act, Regulation and Code, and our fleet safety program is in compliance with Alberta Transportation rules and regulations.
- We continue to align our safety management system to ISO 45001.
We also maintain an Alberta Certificate of Recognition (CoR) to meet provincial safety standards.
To maintain our CoR, we must subject our safety management system to a third-party audit that includes employee interviews at all levels, a review of documentation and observations of workplace conditions and practices every three years.
- Our environmental management system is modeled after the requirements of Electricity Canada's Sustainable Electricity™ program and aligned with ISO 14001:2015, an international standard for environmental management systems.
- Versant Power has its own robust safety management system aligned with ISO 45001.
Each year Versant Power develops and receives executive approval for its Safety Management System Action Plan, which contains more than 35 separate actions and metrics within the 10 management system elements.
The action plan includes all aspects of Versant Power's safety program and has strong accountabilities built into it.
Versant Power is committed to completing a minimum of 90 per cent of those actions, and the results are verified by an ENMAX auditor.
56 ENVIRONMENT ENMAX 2021 ENVIRONMENTAL, SOCIAL & GOVERNANCE REPORT CEO LETTER ESG SCORECARD Customer satisfaction WHY IT MATTERS TO ENMAX ABOUT ENMAX SOCIAL GOVERNANCE TCFD APPENDICES OUR PERFORMANCE CUSTOMER SATISFACTION IN ALBERTA per cent 100 - 82 86 86 90 - - - Customer satisfaction in Maine - As a provider of essential energy products and services, ENMAX Energy serves approximately 700,000 residential, commercial and industrial customers in Alberta, and Versant Power serves approximately 160,000 customers in Maine.
OUR APPROACH We take the customer experience seriously and approach customer satisfaction with the philosophy that "every moment matters".
We aim to treat every customer with respect, kindness and empathy.
Customer satisfaction in Alberta To continue improving customer satisfaction, we have a dedicated, locally based team of 250 employees who work in our customer care centre in Alberta.
Our customer care agents receive more than 665,000 calls per year.
Additionally, we receive approximately 44,000 responses to our Voice of the Customer survey (a 12 per cent response rate) each year.
We analyze the data trends and look for opportunities to improve our processes and coach or reward our agents.
Our High Five Program recognizes agents who receive five out of five in customer ratings.
Versant Power has a customer contact centre staffed with local customer service representatives in two locations in Maine: Presque Isle and Bangor.
To foster high-quality customer service, Versant Power provides a 10-week training program to onboard new representatives and offers continuing coaching and training for tenured representatives.
The company also has an online user portal to view and pay bills, report and see status on outages and to view daily and hourly usage information.
Customers who use online services also receive weekly usage reports by email and can sign up for high usage alerts by email or text.
As a retailer of electricity and energy services, we serve more than 850,000 residential, commercial and industrial customers in Alberta and Maine.
- 0 2017 2018 2019 2020 2021 While customer satisfaction was slightly lower in 2021 compared to 2020, overall, customer satisfaction has increased by six per cent over the past five years.
We continue to invest time and resources in understanding our customers' needs.
Note: Chart data excludes Versant Power.
CUSTOMER SATISFACTION IN MAINE (VERSANT POWER) METRIC TARGET* 2021 PERFORMANCE Responsiveness to customer calls (calls answered in 30 seconds) 80% 76.5% Call abandonment rate 7% 7% Bill error rate <0.40% 0.31% We met our targets for bill error and call abandonment rates but fell short of our target to answer 80% of calls in 30 seconds.
We continue to work to improve our responsiveness to customer calls.
* These targets are established by the Maine Public Utilities Commission.
< > 57 CEO LETTER ENVIRONMENT APPENDICES ENMAX 2021 ENVIRONMENTAL , SOCIAL & GOVERNANCE REPORT ESG SCORECARD ABOUT ENMAX SOCIAL GOVERNANCE TCFD SPOTLIGHT The next step in modernizing the grid ENMAX Power is running a pilot project to test Advanced Metering Infrastructure (AMI) in a few Calgary communities to improve metering capability and provide customers with actionable insights on their energy consumption.
AMI is an integrated system made up of advanced electricity meters, a wireless communications network, and the data management systems necessary to enable remote two-way communication between utilities and meters.
The ENMAX Power pilot is currently testing AMI technology on a small scale as we believe this is the next step in servicing a modernized grid.
The area included in the pilot was chosen for its good mix of residential, small, medium and large commercial customers, its sites with distributed energy resources, and its already high saturation of existing AMI-capable meters.
ADVANCED METERING + COMMUNICATION NETWORK + DATA MANAGEMENT SYSTEMS two-way communication between meters and utilities O O 1 O PILOT: HOME ENERGY MONITORS AMI-CAPABLE METERS GATEKEEPERS PROGRESS 11 10,300 AMI-capable meters installed by our meter technicians in this pilot area in 2021 5 5,531 meters successfully sent data to test in our billing system through the gatekeepers home energy monitors tested in 2021 gatekeepers installed in 2021 Home energy monitors are in-home devices that provide customers with better information on their electricity use.
Using load disaggregation technology, the devices split a customer’s load profile information into possible consumption categories (e.g., lighting, heating, appliances, etc.).
Breaking the consumption number into something more tangible provides customers with useful and actionable insights on their areas of highest energy use so they can make changes accordingly.
An AMI-capable meter offers two-way communication between users and the utility.
It is ENMAX Power's practice to install AMI-capable meters on new homes built after 2018 or sites that require meter replacements, but we have not yet harnessed their advanced metering capabilities.
Through this pilot we are testing two-way communication in select neighbourhoods.
Out of 530,000 meters in our service area, there are 190,000 homes and businesses that have AMI-capable meters already installed for future opportunities.
Gatekeepers are the centre point that collects the data from AMI-capable meters and sends it to the ENMAX Power system through a secure wireless connection—very similar to how a mobile device reports to a cell tower.
Testing on the functionality of the infrastructure began in 2021—including getting reads, testing alarms, testing remote functions and overall two-way communication capabilities, etc.
While testing on AMI technology is occurring behind the scenes, customers will not see any change to their service or bills.
58 GOVERNANCE TCFD APPENDICES ENMAX 2021 ENVIRONMENTAL , SOCIAL & GOVERNANCE REPORT CEO LETTER ESG SCORECARD Cybersecurity and data privacy WHY IT MATTERS TO ENMAX Resilience to cyber threats is exceptionally important for organizations like ours that own and operate critical electricity infrastructure.
We place high attention on maintaining the cybersecurity of our operational technology systems as they directly impact physical systems and the delivery of power to our customers.
Further, the trust placed in ENMAX by customers and stakeholders requires that we uphold the personal information standards set out in Alberta’s Personal Information Protection Act in connection with the proper collection, use, disclosure and storage of personal information.
OUR APPROACH We align to the following frameworks that guide our cybersecurity practices: NIST CYBERSECURITY FRAMEWORK The National Institute of Standards and Technology (NIST) framework is considered a best practice in cybersecurity for utilities.
ENMAX regularly completes NIST cybersecurity maturity assessments to continually advance the maturity of our alignment with the framework.
ABOUT ENMAX ENVIRONMENT SOCIAL 2021 HIGHLIGHTS → Advanced our incident response planning and tabletop exercises.
→ Enhanced our privacy training to be rolled out in 2022.
CRITICAL INFRASTRUCTURE PROTECTION RULES PRIVACY COMPLIANCE We comply with the Alberta Reliability Standards, which requires following Critical Infrastructure Protection on the Bulk Electric System.
CENTER FOR INTERNET SECURITY CONTROLS We implement security controls in line with the Center for Internet Security (CIS) security controls standard and maintain an advanced suite of software for threat detection, log processing and monitoring.
We conduct regular testing and retain external cybersecurity experts to provide audits.
ENMAX regularly reviews and updates policies and procedures governing the proper collection, use and disclosure of personal information of our customers, employees and other individuals whose information is in our custody or control.
Our employees receive annual training in this regard as well as regular privacy updates and communications to keep this important risk area top of mind.
59 Calls Waldng 092959 0 Thursday - November 29 Loomis Express ENMAX 2021 ENVIRONMENTAL, SOCIAL & GOVERNANCE REPORT ABOUT ENMAX ENVIRONMENT SOCIAL GOVERNANCE TCFD APPENDICES CEO LETTER Cybersecurity awareness Training our employees on cybersecurity empowers them to recognize potential threats and helps to prevent cyber-related incidents.
As employees join the company, our mandatory corporate training includes a module on cybersecurity and data protection.
We offer regular cybersecurity awareness courses and hold an in-depth Cybersecurity Awareness Month in October during which we circulate relevant articles, share tips of the day, and host virtual events with guest speakers such as the Calgary Police Service's Cyber Crime Unit.
We also have a comprehensive phishing performance management process, monthly phishing tests and supplemental training for employees.
ESG SCORECARD PROGRESS IN 2021 We have been refining and maturing our response to cybersecurity-related events through improved incident response planning and tabletop exercises.
As an organization, we use the Incident Command System (ICS) to manage our incident response.
In 2021, we improved the integration of our cyber incident response plan with our existing ICS incident response process, allowing for a more rapid and coordinated resolution to incidents.
We also completed several cybersecurity assessments including security evaluations of our most critical business services and conducted exercises where we simulated attacks and monitored how our controls responded to them to assess and strengthen our cybersecurity posture.
STORY CUSTOMER DATA PRIVACY As an essential services organization, our business requires the collection and management of customer data.
We collect only the data we require to provide service to our customers, such as billing details.
Additionally, we restrict data accessibility and all instances of access to customer data is logged and auditable.
Every customer service agent in our customer care team receives data privacy and protection training when hired.
We also provide regular training updates and recognize Cyber Security Awareness Month with speakers and hosted activities to communicate additional messaging about data protection.
Each year, we diligently educate employees on the importance of data protection and promote awareness of potentially fraudulent activity by third parties as and when we become aware of such attempts by individuals or organizations misrepresenting themselves as ENMAX.
= 0 < > 60 ENMAX 2021 ENVIRONMENTAL, SOCIAL & GOVERNANCE REPORT GOVERNANCE TCFD APPENDICES CEO LETTER Responsible procurement ESG SCORECARD ABOUT ENMAX ENVIRONMENT SOCIAL 2021 HIGHLIGHTS > Reinstituted our Environmental Responsibilities Document with contractors.
Improved the hydrovac slurry management requirements for our contractors.
WHY IT MATTERS TO ENMAX We are committed to fair competition in all dealings with suppliers and to making our purchases honestly and objectively.
We also want to make sure that our suppliers and contractors respect and uphold our ethical, safety and environmental practices.
OUR APPROACH Our contractor screening process is designed to verify that any contracted companies we work with have similar safety practices and systems to ENMAX.
We are currently using ISNetworld, an online data- driven contractor and supplier management platform.
Through the platform, we can verify contracted companies have insurance and appropriate safety performance and practices.
Read more about contractor safety on page 35.
In 2021: - Versant Power began implementing ISNetworld with support from ENMAX in early 2021.
For the first phase of implementation, Versant Power concentrated on high-risk vendors and completed onboarding of more than 90 vendors by December 2021.
In 2022, the company plans to develop an action plan to further leverage the ISNetworld platform and to expand capabilities.
- ENMAX reinstituted our Environmental Responsibilities Document (ERD) with our contractors to reflect new hydrovac slurry management and soil disposal requirements, as well as providing a refresh to the document.
To have a Master Service Agreement (MSA) or other working agreement, contactors must first sign the document and return it to ENMAX to acknowledge their responsibilities.
The document now contains a link to the Contractor Access Portal where all relevant ENMAX environmental procedures are stored, so contractors can ensure they meet or exceed our practices.
Supply chain resiliency In 2021, the COVID-19 pandemic continued to affect global supply chains with delays to materials and products, increases in lead time and costs, and skilled labour shortages.
We have worked proactively to navigate the ongoing situation by strengthening our supplier relationship management, placing orders ahead of time, monitoring changes in the market, and working with our own business units to advance materials planning.
Public policy WHY IT MATTERS TO ENMAX We aim to act honestly and with integrity in all business relationships, including in our interactions with government officials.
Our public policy interactions include direct interactions with government officials and administrators.
OUR APPROACH We comply with all provincial, state and federal lobbying legislation in Canada and the United States, as applicable.
We have an internal lobbying policy and provide training for any executives and directors that interact with government officials.
We track and report lobbying activities to the Office of the Ethics Commissioner of Alberta and to the Federal Office of the Commissioner of Lobbying to comply with the lobbying requirements that are directly focused on policies, programs and regulations.
To support industry positions and to stay informed of policy development, we are also members of industry associations such as Electricity Canada, Independent Power Producers Society of Alberta, the Edison Electric Institute, and the Alberta Energy Retailers and Service Providers Association.
61 ENMAX 2021 ENVIRONMENTAL , SOCIAL & GOVERNANCE REPORT ESG SCORECARD ABOUT ENMAX ENVIRONMENT SOCIAL GOVERNANCE - TCFD APPENDICES CEO LETTER TCFD TASK FORCE ON CLIMATE-REL ATED FINANCIAL DISCLOSURES IN THIS SECTION… Governance of climate-related risks and opportunities 63 Risk management 64 Climate-related physical risks 65 Transition-related risks and opportunities 66 Climate-related scenarios 69 Metrics and targets 70 62 ENMAX 2021 ENVIRONMENTAL , SOCIAL & GOVERNANCE REPORT ENVIRONMENT SOCIAL GOVERNANCE TCFD APPENDICES CEO LETTER Governance of climate-related risks and opportunities We have risk oversight and management at the Board, executive and management levels.
Board oversight At ENMAX, the Board of Directors has the highest level of oversight for climate-related risks and opportunities.
The Board’s role is to oversee ENMAX’s strategy and the development of its ESG targets, ensure alignment between ESG efforts and business strategy, and hold responsibility for the organization’s risk profile.
In 2021, the Board approved the involvement of the Governance Committee in ESG-related matters as an enhancement to our ESG framework.
The Governance Committee supports the Board in fulfilling its role by: – Reviewing quarterly reports on ENMAX’s risk, risk rating and risk tolerance.
Our risks include environmental and social risks, climate-related risks and opportunities such as extreme weather events, carbon regulations and transition-related electricity demand changes.
– Discussing and reviewing ESG and climate-related matters at Board meetings; – Approving the publication of our annual ESG report; – Making recommendations regarding the development and ongoing refinement of our ESG targets; – Reviewing our progress and performance against our ESG targets; and – Reviewing periodic reports related to developments, trends, best practices, risks and issues related to our ESG targets and reporting.
ESG SCORECARD ABOUT ENMAX Management’s role To better understand and manage the full spectrum of climate-related risks and opportunities, we have three teams that support our Executive Team.
Two teams are focused on risk management and the other on finding opportunities.
The Risk Management Committee (RMC) is an executive-level committee whose role is to oversee our Enterprise Risk Management program.
The committee supports business units in identifying and assessing risks, and then consolidates information to be presented to the Governance Committee of the Board.
Once risks have been identified, each area of the business where the risks reside is responsible for implementing risk management plans.
The Commodity Risk Management Committee (CRMC) is similar to the RMC but focuses exclusively on identifying and managing our exposure to natural gas and electricity market risks.
This committee oversees our commodity hedging program and manages risks for our offset and Renewable Energy Certificate commercial activities.
The Renewables Business Development Group is evaluating opportunities for commercial and utility- scale renewable energy generation options backed with long-term contracts to help our customers meet their ESG goals.
STORY TCFD RECOMMENDATIONS The Task Force on Climate-related Financial Disclosures (TCFD) provides recommendations for effective climate-related disclosures that can promote more informed investment, credit and insurance underwriting decisions.
The following pages outline our responses to these recommendations.
We recognize that climate change is an important and complex issue that impacts businesses and communities.
ENMAX is committed to playing an active role in the energy transition and in addressing climate change.
三 63 ENMAX 2021 ENVIRONMENTAL, SOCIAL & GOVERNANCE REPORT ABOUT ENMAX ENVIRONMENT SOCIAL GOVERNANCE TCFD APPENDICES CEO LETTER Risk management Effective risk management empowers us to actively identify, assess and manage risks to our business.
We work to develop, monitor and progress our risk management strategies to ensure they are both representative of key impact areas of our business and address changing environmental and social matters.
ENMAX uses an established Enterprise Risk Management (ERM) program to identify, analyze, evaluate, treat and communicate our risk exposures in a manner consistent with our business objectives and risk tolerance.
Our ERM program helps us monitor and evaluate financial, reputational, regulatory, environmental and social risks.
Risk identification As part of our ERM program, we identify and group risks into 10 categories that include operational, financial, regulatory, customer- and cybersecurity- related risks.
Although the categories remain relatively unchanged, the specific risks within each category are reviewed quarterly.
To support a broad understanding of risk across the company, we also identify and evaluate emerging risks, which include ESG- and transition- related risks, as well as technology disrupters and innovators.
Even if some of those risks do not meet our criteria for top risks, we discuss them with the Executive Team and the Board of Directors quarterly.
In 2019, we incorporated climate-related risks into the most impacted risk categories within our existing ERM program.
The most relevant physical and transition- related risks are summarized on page 65.
ESG SCORECARD Risk assessment For each of our identified risks categories, we evaluate the level of residual risks (after mitigation is in place).
We also use specific signposts (e.g., results of a local or federal election, publication of a regulation) to ensure consistency of risk evaluation and provide guidelines for risk assessment.
Our risk group meets quarterly and updates the Board of Directors on changes to risks assessment and/or new risks each quarter.
Risk integration We incorporate climate-related risks into different aspects of our business by: - Providing a quarterly ERM update to our Executive Team and Board of Directors with any new observations or issues related to our key risk areas and an overall assessment of our corporate-wide risk level; - Considering the impact that new investments have on our greenhouse gas (GHG) emissions profile; - Incorporating extreme weather events into emergency preparedness (read more on page 26); - Commodity risk forecasting and management; and - Severe weather planning at Versant Power to ensure resources are available for potential infrastructure impacts.
> 64 ENMAX 2021 ENVIRONMENTAL, SOCIAL & GOVERNANCE REPORT ABOUT ENMAX ENVIRONMENT SOCIAL GOVERNANCE TCFD APPENDICES CEO LETTER ESG SCORECARD Climate-related physical risks The ENMAX group of companies operates in two distinct geographical regions with different types and levels of climate-related physical risks.
While both regions are exposed to winter storms and other severe weather events, Calgary has a more targeted flood preparedness program and Maine a robust tree and vegetation management program, based on their specific regional needs.
In the next two years, we plan to develop a more robust climate mitigation plan for both areas.
Our key climate-related physical risks in Alberta include: FLOOD After the 2013 Calgary flood, we revised our internal mapping to include flood inundation zones and evacuation zones (provided annually by The City of Calgary).
Our flood maps indicate our circuitry, meters, the number of customers affected per zone and in what order.
