50 40 - 36 34 35 - - 2017 0 2018 2019 2020 2021 2017 2018 2019 - 2020 2021 2017 2018 2019 Board Senior Management 2020 2021 Workforce We have gender balance in senior management roles (senior vice-president and above), but will continue working on promoting diversity, inclusion and belonging across the entire organization.
REVISED PARENTAL LEAVE POLICY To make parental leave more accessible for a wider range of employees, we revised our Employee Parental Leave Policy to include six weeks of vacation accrual.
Employees who elect to take parental leave (which includes adoption leave) are provided with 75 per cent base salary top-up eligibility for up to six weeks and are able to use vacation or other accrued time banks to top up the remaining 25 per cent.
38 ENVIRONMENT GOVERNANCE TCFD APPENDICES ENMAX 2021 ENVIRONMENTAL, SOCIAL & GOVERNANCE REPORT CEO LETTER Fostering inclusive leadership We want to foster a culture where employees feel a sense of belonging and believe that this starts with inclusive leadership.
Inclusive leaders respect the uniqueness of each individual and create an environment where all individuals can unlock their potential, thrive and grow.
INCLUSIVE LEADERSHIP TRAINING In our 2020 ESG report, we set a target for all ENMAX senior leaders (directors and above) to complete inclusive leadership competency training.
In 2021, 100 per cent of our senior leaders completed this training.
The inclusive leadership training supports leaders in developing foundational knowledge of their own unconscious bias, helping them understand the business case for diversity, inclusion and belonging, and how to leverage a team's diversity of thought and styles.
It also equips leaders with tips to start healthy conversations about diversity and inclusion with their teams.
In 2022, we will be offering a second module for senior leaders and will roll out the program to all other people leaders across ENMAX.
CREATING INCLUSIVE TEAMS PANEL As part of our annual Leadership Summit for all people leaders, we hosted a 90-minute Creating Inclusive Teams panel discussion.
The panel featured five individuals who are diversity and inclusion ambassadors within their communities and organizations.
The panelists discussed how belonging and inclusion impacts team success and shared tips on how leaders can foster an environment for inclusion.
ESG SCORECARD ABOUT ENMAX SOCIAL Supporting holistic wellness We strive to help our employees maintain balance across different health dimensions including financial, physical and mental wellbeing.
OUR PERFORMANCE MENTAL WELLNESS In 2021, we added a new Mental Fitness program to our existing offerings.
The program kicked off with a Mental Fitness 101 course attended by 197 employees which helped participants assess and build positive mental fitness.
The program encouraged participants to reflect on what charges and drains their mental fitness "batteries".
Mental Fitness 101 set the tone for six Microskills sessions attended by 335 participants.
Mental Fitness Microskills are short webinars that focus on skill development to positively impact an individual's mental fitness.
love QUEEN WELLNESS In 2021, Versant Power launched a new wellness initiative that includes mental wellbeing and financial and physical health.
Versant Power offered monthly wellness webinars and an app called My Strength, which-like ENMAX's headversity app-offers resilience challenges, breathing exercises, training and more.
Kindnes HANF カ プ キ For Pink Shirt Day, we encouraged our employees to wear a pink-coloured shirt to stand against bullying.
39 ENVIRONMENT GOVERNANCE TCFD APPENDICES ENMAX 2021 ENVIRONMENTAL, SOCIAL & GOVERNANCE REPORT CEO LETTER ESG SCORECARD Developing a culture of inclusion We believe the skills and awareness we gain from having difficult conversations make our culture more welcoming.
In 2021, we created several opportunities for these types of conversations to occur and are seeing a shift in how our organization engages on these topics: INCREASING AWARENESS OF INDIGENOUS HISTORY AND CULTURE 175 of our employees attended an Indigenous awareness session which covered Indigenous history, cultural differences, working with Indigenous Peoples and communities, and more.
Read more on page 51.
ENMAX also encouraged employees to complete the online Indigenous Canada course by covering the certification fee.
Indigenous Canada is a 12-lesson course from the Faculty of Native Studies at the University of Alberta that explores Indigenous histories and contemporary issues in Canada.
CREATING OPPORTUNITIES FOR EMPLOYEE CONNECTION We organized several employee connection sessions to destigmatize conversations around diversity and inclusion.
The sessions were limited to groups of eight or fewer employees to provide a safe space for employees to share their personal experiences, identify potential barriers that our team members face and discuss actions or ideas for ENMAX to foster a culture of belonging in the workplace.
ABOUT ENMAX DIVERSITY TRAINING FOR EMPLOYEES As part of its corporate mandatory training, Versant Power launched a new training course with an emphasis on diversity and inclusion.
The company also added visual aides and read-along capabilities to the courses to enable different learning styles and improve accessibility.
We believe the skills and awareness we gain from engaging in conversations around diversity and inclusion make our culture more welcoming.
PROMOTING ALLYSHIP Employees were invited to attend Allyship in Action, a virtual session hosted as part of our partnership with Calgary Pride.
The session explored the importance of allyship in our communities, the diversity within our human identity (including gender identity, gender expression, sexual orientation and attraction) and provided participants the opportunity to have their questions answered by Calgary Pride hosts.
This session was also recorded for employees to view in the future.
SOCIAL STORY SUPPORTING THE CALGARY PRIDE FESTIVAL STANDING AGAINST BULLYING AND HARASSMENT We encouraged all team members to wear pink on Pink Shirt Day (February 24, 2021).
We also provided information on how to stand against bullying and harassment and where to turn for help.
Pink Shirt Day began in 2007 when a student in Nova Scotia was bullied for wearing a pink shirt to school.
It has since been recognized annually worldwide as a day to stand against bullying.
Since 2017, we have supported the people behind the scenes who bring the Calgary Pride Festival to life each year.
From transporting artists to moving boxes, volunteers feel a greater connection to the community by volunteering with Calgary Pride.
We are proud to support such a strong, resilient community.
WANT TO LEARN MORE?
Click here to watch our video on supporting our LGBTQ+ community.
5 > 40 APPENDICES ENMAX 2021 ENVIRONMENTAL, SOCIAL & GOVERNANCE REPORT CEO LETTER ESG SCORECARD Employee engagement and development ABOUT ENMAX ENVIRONMENT 2021 HIGHLIGHTS SOCIAL GOVERNANCE TCFD > Completed third annual employee engagement survey.
Launched a senior leader coaching program to support leaders during times of change.
WHY IT MATTERS TO ENMAX Fostering the potential of our people is critical to our success as an organization.
Engaged employees have fewer safety incidents, are healthier and more customer- focused, and feel valued, respected and invested in their own success.
Strong employee engagement and development improves organizational effectiveness and contributes to a more satisfied workforce, increased retention and a better bottom line for our Shareholder.
OUR APPROACH We care about how committed, invested and engaged our team members are.
We understand that learning and development are critical factors in employee engagement, and therefore target our programs to support employee growth by providing opportunities for career development.
We offer competitive wages and benefits, professional development, and human resources programs and practices such as succession planning for key positions.
At ENMAX, we complete annual employee engagement surveys and are working to ingrain employee engagement into daily practices.
In Maine, Versant Power's talent acquisition practice is to source talent from the local service territory.
The company also completes employee engagement surveys and has a tuition reimbursement policy.
PROGRESS IN 2021 Over the past year, we have continued to measure and improve our employee engagement and have worked to support the learning, development and advancement of our team members in the following ways: Measuring engagement We have conducted an annual employee engagement survey through Gallup since 2019.
After each of these surveys, all employees receive access to the survey results and are involved in action planning within their teams.
In 2021, our employee participation rate reached an all-time high of 90 per cent (up from 88 per cent the previous year) and exceeded the average participation rate of 82 per cent among utility peers according to Gallup.
In all three years distributing the survey, we chose to add several questions surrounding a "culture of inclusion" to understand how confident team members are that company practices are ethical, that their voice is heard, and that they are treated inclusively and with respect.
We were encouraged to see increases in all three dimensions of the "culture of inclusion"-related questions, which suggests that employees feel our workplace operates with respect and integrity and that ENMAX is committed to building the strengths of each employee.
Since 2019, our results have shown meaningful improvements across Gallup's core engagement questions.
In November 2021, Versant Power launched its first engagement survey through Gallup, which will help provide a consistent and common line of sight on engagement across both ENMAX and Versant Power.
To follow up on the survey results, leaders will be developing and implementing action plans in 2022.
= 0 ← → 41 ENMAX 2021 ENVIRONMENTAL, SOCIAL & GOVERNANCE REPORT ABOUT ENMAX ENVIRONMENT GOVERNANCE TCFD APPENDICES CEO LETTER ESG SCORECARD Learning and development Our goal in 2021 was to provide learning opportunities for leaders that developed skills and capabilities in key areas to support our leaders' and teams' success through the constantly changing environment.
In addition to skill development, our learning opportunities created a sense of belonging and connection for participants.
We advanced our learning and development offerings this year through: TALENT MOBILITY We continued to mature our talent programs and develop our leadership pipeline through ongoing focus on development needs, internal mobility, project work and succession planning.
Development plans include targeted leadership development opportunities, from offering education to address specific needs, to providing opportunities for leaders to gain exposure and skill development experience.
ENMAX's succession program enhances cross-functional awareness of our talent pool, identifies development areas and mitigates the risk of unexpected leadership vacancies.
Succession plans for all director-level leaders were completed in June 2021.
INDUSTRY ACUMEN This program provides industry-related information and technical knowledge for those new to ENMAX or the electricity industry.
In 2021, over 40 employees participated in a revamped program that provided new self-paced e-learning content, offered sessions hosted by ENMAX's own senior leaders, and shared industry knowledge from Western Energy Institute speakers.
MENTORSHIP We continued our internal mentorship program, which matched 141 mentors and mentees in 2021 and established mentoring relationships over six months.
COMMUNICATION FOR LEADERS We launched two programs to provide communication tools to leaders across ENMAX.
First, more than 31 directors and vice presidents received Communication for Senior Leaders, a four-week training program with one-on-one coaching that helps senior-level leaders craft a compelling vision, clear messaging and cultivate a leadership presence through their communications.
Stemming from positive feedback about the first program, we launched Speaking as a Leader.
In 2021, 20 mid-level leaders participated in this four-week program and learned how to communicate a powerful message in a concise and clear manner.
SENIOR LEADERSHIP COACHING To help our leaders navigate times of change, we identified a group of senior leaders who were leading critical transformation within their teams.
We partnered with a Calgary-based executive coaching firm to support them for six to eight months, providing each with individualized coaching to help with their leadership and personal development needs.
COACHING 101 In 2021, ENMAX also piloted a three-hour introduction to coaching program for 49 leaders, focusing on building the fundamental coaching skills and providing a framework for effective coaching conversations.
SOCIAL STORY ENGAGING OUR EMPLOYEES IN INNOVATION In spring 2021, we hosted an Innovation Challenge across our ENMAX Power and ENMAX Corporation business areas.
The goal of the challenge was to engage employees in the generation of ideas that could advance ENMAX Power's vision of meeting the future needs of our customers and communities through advancements in technology, electrification and distributed energy resources.
Team members contributed more than 70 submissions with ideas spanning automation and digitization, through to augmented and virtual reality training and everything in between.
Four winning ideas, including one employee choice, along with seven finalists were selected by a senior leadership committee.
ENMAX Power is formalizing the process to allow team members to submit project ideas throughout the year for review.
Each project will move through a governed approval process to allow for more expedited decision making and stakeholder input towards implementation.
TYPES OF IDEAS 41 total ideas 9 - Automation & Digitalization 6 - Analytics & Machine Learning 7 - Microgrids 6 - Customer Communication 5 -Work Methods 4 - Energy Storage 4 - Augmented and Virtual Reality 0 42 ENMAX 2021 ENVIRONMENTAL, SOCIAL & GOVERNANCE REPORT ABOUT ENMAX ENVIRONMENT TCFD APPENDICES CEO LETTER ESG SCORECARD Unions WHY IT MATTERS TO ENMAX We welcome the contributions of organized labour and respect the right of our employees to associate.
More than 60 per cent of our workforce is represented by union members of the International Brotherhood of Electrical Workers (IBEW) Local 254 and the Canadian Union of Public Employees (CUPE) Local 38.
Fifty per cent of Versant Power's workforce is represented by the IBEW Local 1837.
OUR APPROACH We endeavour to be proactive in our communications and transparent as decisions are made.
We consult with union representatives in advance of any policies or business initiatives that directly impact union members.
Collective bargaining agreements for both unions have a well-defined and documented process for raising grievances.
Collective agreements In 2021, ENMAX successfully negotiated a collective agreement with CUPE, which was ratified by the majority of the membership.
In 2022, ENMAX will be engaging in negotiations with the IBEW in Alberta and Versant Power with the IBEW in Maine.
Valuing our collaborative relationships We value the positive relationships we have with our bargaining unit representatives.
Some of the most common matters we work with our unions on are compensation, job stability and outsourcing.
We strive for open two-way dialogue to enable effective issue resolution.
To promote collaborative union relationships in Alberta, some of the structures we have in place include: EMPLOYEE RELATIONS COUNCIL This council (which is a bargaining item within the IBEW) is a way to work through issues or concerns that need to be resolved outside of active bargaining.
BID COMMITTEE This committee, which includes representation from IBEW and ENMAX management, meets as required to discuss any changes to job descriptions or qualifications.
JOB EVALUATION COMMITTEE Any significant changes to job descriptions go to this committee for discussion and agreement.
The committee includes representation from CUPE and the ENMAX labour relations and total rewards teams.
SOCIAL GOVERNANCE STORY FEAT ERLITE.
ENMAX WORKING TOGETHER THROUGH THE PANDEMIC The global pandemic has heightened the need to maintain collaborative and respectful relationships with our unions as we work together through difficult and changing situations.
Keeping our employees' safety always at the forefront, ENMAX has worked to proactively keep our unions informed of our COVID-19 plans and procedures while navigating these challenging times.
43 APPENDICES ENMAX 2021 ENVIRONMENTAL, SOCIAL & GOVERNANCE REPORT CEO LETTER Energy affordability ESG SCORECARD ABOUT ENMAX ENVIRONMENT 2021 HIGHLIGHTS SOCIAL GOVERNANCE TCFD > Met our target to spend at least 30 per cent of our community investment budget on energy affordability.
Increased our funding to three of our long-standing community partners to support basic needs.
WHY IT MATTERS TO ENMAX Electricity is an essential service, and energy affordability is critical to our customers' quality of life.
We aim to help eliminate barriers for vulnerable customers that may impact or inhibit access to safe, reliable and affordable electricity.
OUR APPROACH We focus our energy affordability efforts on supporting customers at each stage of the affordability lifecycle: - Crisis management - relief to customers in energy-need crisis through agency partnerships - Prevention - programming to reduce barriers to affordable-energy access Affordability - sustainable energy solutions, tools, education and awareness We have a range of community partnerships and customer programs in place to improve access to energy: Helping customers understand and optimize energy use For customers who have chosen a competitive retail plan with ENMAX Energy, we offer My Energy IQ™, a free tool to enable customers to take greater control over how they use energy via monthly reports on their energy use, bill comparisons, energy saving tips and more.
To support changing energy needs during seasonal changes, we also publish our Winter Wise and Summer Smart energy savings tips to help customers make energy usage reductions through simple, low-cost ideas tailored to Alberta's climate.
Supporting vulnerable customers In Alberta, our local customer care team offers payment arrangements or installment plans to assist customers who may be struggling to pay their electricity and/or natural gas bill.
To further support vulnerable customers with utility needs, we have long-standing relationships with Trellis Society, Distress Centre Calgary, United Way of Calgary and Area, Bissell Centre, and United Way of Central Alberta.
(Read more on page 46.)
In Maine, Versant Power works closely with state and county programs that qualify customers to receive assistance for heating.
When customers apply for federally-funded heating assistance, they may also qualify to receive assistance through Versant Power's Low Income Assistance Program, which provides an annual credit on electric bills for income-qualified applicants each year they apply.
Low-income residential customers who fall behind on electricity bills may also be eligible for the company's Arrearage Management Program, which applies a forgiveness credit to overdue balances for on-time payments of current bills.
OUR PERFORMANCE COMMUNITY INVESTMENT SPENDING per cent 30% Of our community investment budget supported energy affordability efforts in 2021 STORY MAKING RENEWABLE POWER MORE AFFORDABLE FOR NEW HOMEOWNERS We have partnered with Attainable Homes Calgary to install solar panels (a total of 440 kW DC) on affordable housing units as part of their new REACH at Martindale development.
Attainable Homes Calgary is a non-profit organization, created and owned by The City of Calgary, which helps moderate-income Calgarians achieve quality home ownership.
REACH at Martindale is a 12-building multi-family development with an arrangement of regular and stacked townhomes and includes 116 residential homes.
To lower the cost of power for the new homeowners, each unit is designed to be highly energy efficient and will include standard solar panels.
0 44 ENVIRONMENT GOVERNANCE TCFD APPENDICES ENMAX 2021 ENVIRONMENTAL, SOCIAL & GOVERNANCE REPORT CEO LETTER ESG SCORECARD ABOUT ENMAX SOCIAL PROGRESS IN 2021 To manage our energy affordability efforts across Alberta and Maine, last year we established an internal cross-functional Energy Affordability Working Group.
The team is tasked with developing and implementing a strategy to promote continued attention and action on energy affordability-related efforts.
Our focus in 2022 will be on progressing our pilot projects and providing customers with access to better information on how they use and can optimize their energy.
Targeted community investment In 2020, we set a target to spend at least 30 per cent of our community investment budget each year on activities and organizations that support customers at the various stages of the energy affordability lifecycle.
In 2021, 30 per cent of our investment was directed towards this area, meeting our target.
(Read about some of our funding allocations on page 46.)
Energy saving kits pilot We are making progress towards our target to deliver 1,000 energy saving kits to Albertans by the end of 2022.
The energy saving kits are designed to support customers experiencing difficulty paying their bill and who may have higher than average energy use.
The kits include clear information on how to save energy and products that create energy savings like LED light bulbs and insulating weatherstripping.
In 2021, we trained our Customer Care team to identify customers who could most benefit from the kits.
We chose a vendor to supply the kits, worked with them to select appropriate items for the kit and developed the kit's education pieces.
Energy efficiency workshops Recognizing that education is a key part of energy affordability, we have partnered with Green Calgary in a pilot project to deliver tailored energy efficiency workshops to at least 500 people during 2022.
The workshops will provide energy efficiency strategies, tips on understanding your bill and other energy-saving content customized to the unique interests of each group (e.g., newcomers to Calgary or those who live in apartments).
Demand-side management ENMAX submitted an application to the Alberta Utilities Commission (AUC) to advocate for the development and launch of a demand-side management (DSM) program.
DSM programs encourage customers to reduce their electricity use by shifting their usage to avoid periods of high demand on the distribution system and/or through investment in energy efficiency measures.
DSM programs are common across many North American jurisdictions.
Customers enjoy many benefits of utility-led DSM programs such as reduced electricity costs and reduced environmental impacts.
ENMAX requires approval from the AUC in order to proceed with any DSM program.
Energy Efficiency Kit 1 PROVIDED BY ENMAX ›› Unbox.
Install.
Save energy.
POLAR PILAR BEAR - PILAR BEAR -- PITILAR BEAR LAR EAR MOUTURE PROT FOAM INSULATI RUBAN EN MOU ALEPREUVE DE POLAR BEAR MOISTURE PROOF FOAM INSULATING TAPE FUMAN UN MOUSSE ISOLANT A L'EPREUVE DE L'HUMIOITE OINTA ASLANTE -- 10 Understanding your bill We made updates to our website to help customers better understand their bill.
The ENMAX Energy Understanding Your Bill page provides a bill charges breakdown with an example of what an average ENMAX Energy residential customer's bill could look like.
We also shared the video, A closer look at your bill.
--- CINTA AISLANTE DE ESPUMA RESISTENTE A LA HUMEDAD simply.
comerve E ChidiSchety CeBy -- - CAM PIS We are making progress towards our target to deliver 1,000 energy saving kits by the end of 2022.
The energy saving kits are designed to support customers experiencing difficulty paying their bill and who have higher than average energy use.
45 ENMAX 2021 ENVIRONMENTAL, SOCIAL & GOVERNANCE REPORT CEO LETTER ESG SCORECARD ABOUT ENMAX ENVIRONMENT SOCIAL GOVERNANCE TCFD APPENDICES SPOTLIGHT Supporting basic needs in our communities - Alberta As part of our commitment to support energy affordability efforts, we have strengthened our focus on basic needs funding.
In 2021, we increased our funding to three of our long-standing community partners, Trellis Society, Distress Centre Calgary and United Way of Calgary and Area.
These partnerships support the crisis intervention stage of the energy affordability lifecycle and allow us to direct people to organizations to get the help they need.
Increasing our support of these agencies means that more families and individuals will have access to funding for essential needs and services.
TRELLIS SOCIETY Trellis Society works with children, youth and families, offering programs to improve access to resources, developing family and community supports.
Among other services, they provide preschool and after-school educational programming to children, shelter for youth or families in need, and employment and housing support.
DISTRESS CENTRE Distress Centre Calgary helps provide 24-hour crisis support, professional counselling, youth peer support and referrals through 2-1-1, as well as runs programs at the multi-agency collaborative Safe Communities Opportunity and Resource Centre-all at no cost to those seeking assistance.
Although Distress Centre defines crisis broadly, they often support individuals or families experiencing domestic violence and other kinds of abuse, mental health crises and suicidal thoughts, and temporary financial hardship or homelessness.
They provide both counselling and housing services.
