ENMAX 2021 Environmental, Social and Governance Report 29 ENMAX 2021 ENVIRONMENTAL , SOCIAL & GOVERNANCE REPORT CEO LETTER Table of contents INTRODUCTION CEO letter 3 Progressing towards our ESG targets 4 Developing a net-zero pathway 6 About ENMAX 9 About this report 13 Our approach to ESG 14 ENVIRONMENT 15 GHG emissions 16 Grid reliability and resiliency 21 Emergency preparedness and crisis management 26 Water use and quality 27 Air quality 28 Land and biodiversity 29 ESG SCORECARD ABOUT ENMAX ENVIRONMENT SOCIAL 31 Employee safety 32 Contractor safety 35 Public safety 36 Diversity, inclusion and belonging 37 Employee engagement and development 41 Unions 43 Energy affordability 44 Community investment and economic impact 48 Community and stakeholder relations 50 GOVERNANCE 52 Corporate governance 53 Ethics 54 Governance for ESG matters 55 Customer satisfaction 57 Cybersecurity and data privacy 59 Responsible procurement 61 Public policy 61 SOCIAL GOVERNANCE TCFD APPENDICES TCFD 62 Governance of climate-related risks and opportunities 63 Risk management 64 Climate-related physical risks 65 Transition-related risks and opportunities 66 Climate-related scenarios 69 Metrics and targets 70 APPENDICES 71 Performance table 72 SASB index 77 GRI Index 79 Forward-looking information advisory 81 £ ↓ £ ↑ 2 ENMAX 2021 ENVIRONMENTAL, SOCIAL & GOVERNANCE REPORT SOCIAL GOVERNANCE TCFD APPENDICES CEO LETTER Letter from our CEO I have long held a personal belief that ENMAX has a critical role to play in the communities it serves.
Not only must we provide our customers with access to safe, reliable and affordable energy, but we must do so responsibly.
Our environmental, social and governance (ESG) framework helps us define what this responsibility entails.
In 2021 ENMAX took the next step in our longstanding commitment to ESG.
After over a decade of reporting on our sustainability efforts, we presented our first formal ESG report with targets against which we could measure our progress on our ESG journey.
This year, we begin sharing our performance and progress towards achieving those targets.
I'm proud of our team members across Alberta and Maine who have worked hard to drive our progress towards these important objectives.
Throughout 2021, the health and safety of our team members and customers remained our highest priority and we continued to advance a strong safety culture as we adapted to the global COVID-19 pandemic.
As a team, we understand that being diverse and inclusive fosters unique perspectives that enhance our culture, as well as inspire creativity and innovation.
We worked towards more inclusive leadership, enabling a culture of belonging.
ESG SCORECARD ABOUT ENMAX ENVIRONMENT The overall theme for 2021 has been one of progress.
In the pages of this report, you will learn how ENMAX is progressing towards a cleaner energy future.
We support Canada's ambition to become net zero by 2050 and want to be part of the solution.
We continue to work towards our own goal of becoming net zero by 2050 by evaluating and leveraging advancements in technology.
We have reduced our GHG emissions by 66 per cent from 2015 to 2021, significant progress towards our interim reduction target of 70 per cent by 2030.
In addition to doing our part to address our impact on climate change, we want to help our customers meet their sustainability goals.
Our customers want solutions that will decrease their environmental footprint: actionable insights into their energy consumption, residential solar systems and electric vehicle opportunities.
We are investing in the electric grid to ensure our reliable and resilient infrastructure will meet future demand.
Energy affordability must go hand in hand with reliability.
In 2021, we contributed $3.25 million to Alberta and Maine community organizations.
To support customers in need, 30 per cent of our community investment budget was spent on energy affordability initiatives, including energy education and energy saving kits that will go to 1,000 homes by the end of 2022.
We are committed to continue working to address the energy affordability challenge through collaboration with our community partners, and an overarching focus on affordable electricity for all of our customers.
As I look back on 2021, I would like to thank the members of the ENMAX team for their hard work to ensure the lights stayed on for our valued customers.
As I look to 2022 and beyond, I'm excited about the progress we will make towards achieving our ESG objectives.
Finally, I would like to thank our customers, who are the focus of everything we do.
They trust us to safely and reliably provide an essential service that we all count on each and every day.
We take that responsibility seriously, today and into the future.
Charles Ruigrok President and CEO 3 GOVERNANCE TCFD APPENDICES ENMAX 2021 ENVIRONMENTAL , SOCIAL & GOVERNANCE REPORT CEO LETTER Progressing towards our ESG targets As an essential service organization, we have a responsibility to our customers and communities.
Our business success is fundamentally linked to how well we manage the environmental impacts of our operations, create an engaging and inclusive workplace, meaningfully contribute to our communities, and uphold strong standards of governance and transparency.
At ENMAX, we are proud of our strong history of achievements in environmental, social and governance practices and performance.
In 2021, the publication of our ESG targets represented the next stage of our evolution as a responsible corporate citizen and future-oriented energy provider.
To facilitate additional transparency around our ESG performance and activities, we have developed a scorecard that aggregates our targets and progress against them (see next page for details).
Details about our initiatives and performance can be found in the rest of this report.
ESG SCORECARD ABOUT ENMAX ENVIRONMENT SOCIAL 4 ENMAX 2021 ENVIRONMENTAL, SOCIAL & GOVERNANCE REPORT CEO LETTER ESG SCORECARD ABOUT ENMAX ENVIRONMENT 2021 SCORECARD How we performed against our ESG targets SOCIAL GOVERNANCE TCFD APPENDICES Met target On track O Did not meet Our current ESG targets cover only our assets and operations in Alberta.
In the next few years, we will work with Versant Power to fully incorporate our operations in Maine into our targets.
The date stated in our targets indicates by year end of the stated year.
TARGET STATUS PROGRESS Greenhouse gas emissions and the energy transition Reduce or offset greenhouse gas (GHG) emissions associated with our power generation portfolio by continuing to invest in efficiency improvements and new technologies.
Commissioned battery storage system at Crossfield Energy Centre avoiding more than 31,000 tonnes CO2e to date.
Completed turbine upgrade at Shepard Energy Centre adding 11 megawatts of generation averaged over the year.
This further increased the efficiency of Shepard.
Offset 100% of our building GHG emissions (scope 1 and scope 2) from 2021 onwards.
Completed offsets purchases for 2020.
2021 offsets purchases will be completed in Q3 2022.
Electrify 35% of our mobile fleet by 2025 towards our aspirational goal of electrifying 100% of our mobile fleet by 2030.
Developed a three-year mobile fleet electrification plan and progressed our medium-duty electric vehicle pilot.
Diversity, inclusion and belonging Complete a third-party assessment of our HR policies to identify additional opportunities to remove bias and promote equal access to opportunities in 2021.
We received the results from the HR policy assessment in December 2021 and will work to implement any changes needed in 2022.
100% of senior leaders (director and above) to complete inclusive leadership competency training in 2021 and all other leaders to complete the training in 2022.
100% of senior leaders completed inclusive leadership competency training.
In 2022, we are offering the program to all other people leaders across ENMAX.
Complete an assessment of our customer and vendor practices by 2023 to identify further opportunities to advance inclusive customer experiences and vendor management processes.
Assessment of vendor and customer practices work has been initiated and will be completed by the end of 2023.
Reliability and innovation ENMAX Power plans to invest $60 million by 2030 to enable a more resilient grid while maintaining its reliability levels.
Invested $4.5 million in 2021 to enable a more resilient grid.
Advanced our electric vehicle (EV) smart charging pilot to understand how Calgarians use EVs and the potential impact on our electricity system.
Energy affordability Spend at least 30% of our community investment budget each year on activities and organizations that support customers at the various stages of the energy affordability lifecycle.
(By 2025, increase the proportion of spending in this area to 40%.)
30% of our 2021 community investment budget was directed towards energy affordability.
We increased our funding to three of our long- standing community partners that support basic needs.
Deliver 1,000 energy saving kits to Albertans by 2022.
Energy saving kits program was initiated and distribution of the kits to vulnerable customers began in 2021.
By 2025, conduct four pilot projects to test programs or solutions that work towards removing barriers to energy access and affordability.
In 2021, we established an Energy Affordability Working Group and initiated one pilot program.
< 5 TCFD APPENDICES ENMAX 2021 ENVIRONMENTAL , SOCIAL & GOVERNANCE REPORT CEO LETTER ESG SCORECARD Developing a net-zero pathway In 2021, we shared our ambition to achieve net-zero scope 1 and scope 2 GHG emissions by 2050.
As with any longer-term target, success would not be possible without realistic near-term milestones and thoughtful planning.
Milestones provide ambitious, yet achievable, guideposts on our journey and we are working towards a 70 per cent reduction of scope 1 and scope 2 GHG emissions by 2030 from 2015 levels.
The illustration on the right represents a progression we envision to achieve net zero by 2050.
While the specifics continue to be developed, the categories we are exploring are based on our current understanding of existing, emerging and potential future technologies.
As technologies advance and become commercially available, and as the energy transition uncovers new possibilities, our pathway will become more defined.
We plan to update our understanding of these opportunities as they change over time and will provide additional detail on our progress in our next report.
ABOUT ENMAX ENVIRONMENT SOCIAL GOVERNANCE NET GHG EMISSIONS kilotonnes of CO₂e 10,000 9,000 8,000 7,000 6,000 5,000 4,000 3,000 L MILESTONE ↓70% by 2030 from 2015 levels 2,000 1,000 NET-ZERO by 2050 0 2015 2020 2025 2030 2035 2040 2045 2050 2015 TO 2020 2020 TO 2025 2025 TO 2035 2035 TO 2050 ACHIEVED EXPLORING EMERGING POTENTIAL – Transitioned – Further efficiency – Carbon capture, – Hydrogen our generation improvements utilization, and – Energy storage portfolio with at natural gas storage (CCUS) – Other our coal PPA terminations generation facilities – Utility-scale renewables technologies – Implemented efficiency improvements – Wind facility capacity increases and/or life – Energy storage – Offsets at natural gas extensions generation – Utility-scale facilities renewables – Offset 100% of – Energy storage building GHG emissions—from 2021 onwards – Offsets WANT TO LEARN MORE?
Click here to read about the options we are exploring.
£ ↓ £ ↑ 6 ENMAX 2021 ENVIRONMENTAL , SOCIAL & GOVERNANCE REPORT CEO LETTER GOVERNANCE TCFD APPENDICES GHG Action Plans During 2022, our focus is to develop GHG Action Plans for all GHG-emitting facilities and business units across ENMAX.
The GHG Action Plans identify benchmark (2015) and projected GHG emissions that are aligned with our budget and long-range plan.
The plans identify potential mitigation actions with estimated emission reductions and costs.
The plans connect to the Enterprise Risk Management (ERM) program to verify that mitigation actions are focused on climate-related risks for each business unit.
As we complete additional work in our journey to net zero, we intend to establish and publish additional milestone targets to keep us on track.
These plans will be updated annually as we continue to adapt to a changing business environment.
Principles guiding our planning We use the following principles to guide us in our exploration of future opportunities.
WE ARE OPEN TO NEW TECHNOLOGIES We believe a combination of technologies and solutions will be required (renewables, fuel and energy efficiencies, energy storage and CCUS) to achieve Canadian and global decarbonization goals.
ENMAX will continue to invest in exploring and implementing new technologies.
WE KEEP OUR CUSTOMERS FRONT AND CENTRE As a customer-facing utility, we consider the impacts our decisions have on our customers and on overall energy affordability.
We also consider our customers’ desire for clean electricity products and a decarbonized grid.
ESG SCORECARD ABOUT ENMAX ENVIRONMENT SOCIAL WE COLLABORATE WITH GOVERNMENTS, REGULATORS, AND OTHER STAKEHOLDERS WE SEEK BROADER BENEFITS Although most projects have a clear environmental benefit, we also consider the social benefits of projects, for example considering community or Indigenous participation in energy projects.
Our pathway assumes a supportive regulatory environment and the availability and commercial viability of technologies, such as energy storage and CCUS.
We continue to engage in conversations with a variety of stakeholders to work towards common goals.
三 7 ENMAX 2021 ENVIRONMENTAL , SOCIAL & GOVERNANCE REPORT SOCIAL GOVERNANCE TCFD APPENDICES CEO LETTER ESG SCORECARD Options we are examining We are committed to enhancing our ESG performance through the exploration and adoption of technologies that can help reduce the emissions associated with our business.
While this is not an exhaustive list, some options we are exploring include: EFFICIENCIES AT NATURAL GAS GENERATION FACILITIES Our commitment to operational excellence means we regularly seek out process efficiencies and incorporate updated equipment as new technologies emerge.
Although there is a limit to the emissions reductions that can be achieved through efficiency, we continue to invest in our natural gas-fuelled generation facilities.
We do this because these facilities enable the integration of intermittent renewable assets into the Alberta grid by providing a backstop to the variability of wind and solar generation.
- RENEWABLES We own and operate two wind facilities—Taber and Kettles Hill—and hold a 50 per cent ownership stake in McBride Lake wind farm.
We are actively exploring potential capacity increases and/or life extensions of our wind facilities.
The benefits of life extension include long-term waste reduction (i.e., waste associated with decommissioning) and an increased return on capital invested.
To inform decision making, we are currently completing end-of-life studies on each wind facility.
We are also evaluating the addition of larger utility-scale solar projects into our generation portfolio to offer options to our commercial and industrial customers to purchase renewable electricity to help achieve their ESG goals.
ABOUT ENMAX ENVIRONMENT CARBON CAPTURE, UTILIZATION, AND STORAGE (CCUS) CCUS is not a new technology, but it is experiencing a surge of global interest.
According to the International Energy Agency (IEA), there are currently more than 20 large-scale CCUS commercial facilities around the globe, and Alberta has committed to fund CCUS projects.
All our power generation facilities are located near advantageous geological formations for storing carbon.
While CCUS requires large capital investment, large volumes of CO₂ can be captured and stored.
ENERGY STORAGE Energy storage using utility scale batteries increases grid flexibility and reliability.
When combined with renewable power generation, batteries can store and release power when needed, which helps balance the electrical grid during periods of low renewable electricity production.
When combined with natural gas generation (such as at our Crossfield Energy Centre) energy storage can also provide standby power without having to burn natural gas.
We will continue to stay informed on relevant technology advancements and pursue opportunities that align with our business and net-zero target.
HYDROGEN While already widely used in some industries, large- scale hydrogen combustion technology continues to advance within the power generation sector.
Already the largest hydrogen producer in Canada, Alberta released its Hydrogen Roadmap in November 2021.
Hydrogen produces no direct GHG emissions and can be blended with natural gas (often with only relatively minor retrofits to natural gas turbines) to generate lower- carbon power.
We are evaluating the feasibility of using hydrogen at our natural gas power generation facilities.
OTHER TECHNOLOGIES In the longer term, as-yet-discovered technologies will emerge and may offer new emissions reduction solutions.
Our Shepard Energy Centre is home to the Alberta Carbon Conversion Technology Centre (ACCTC), which uses exhaust gas from the facility to enable research and innovation focused on finding ways to reduce and repurpose emissions.
Existing and new clients continue to use the ACCTC to develop, validate and pilot technologies that target carbon capture and utilization.
The ACCTC also continues to contribute to economic growth in Alberta as it attracts entrepreneurs and industry conducting research and development.
This research is leading to commercially viable projects and is attracting new business from Alberta and beyond.
8 ESG SCORECARD ABOUT ENMAX ENVIRONMENT SOCIAL GOVERNANCE ENMAX 2021 ENVIRONMENTAL , SOCIAL & GOVERNANCE REPORT CEO LETTER TCFD APPENDICES About ENMAX 4 518 146 49 621 IN THIS SECTION… Key statistics 11 Where we operate 12 About this report 13 Our approach to ESG 14 . cely 8 Westinghouse 136476 cel4 E O F 9 ENVIRONMENT SOCIAL GOVERNANCE TCFD APPENDICES ENMAX 2021 ENVIRONMENTAL , SOCIAL & GOVERNANCE REPORT CEO LETTER ESG SCORECARD About ENMAX The ENMAX group of companies is a leading provider of electricity services, products and solutions.
We are headquartered in Calgary, Alberta, with operations across Alberta and Maine.
Through our subsidiaries, ENMAX Power Corporation and Versant Power, we own and operate transmission and distribution utilities that safely and reliably deliver electricity to customers in Calgary and northern and eastern Maine.
Through ENMAX Energy Corporation, ENMAX owns and operates power generation facilities and offers a range of innovative electricity and natural gas products and services to residential, commercial and industrial customers across Alberta.
- ABOUT ENMAX Shareholder Value Proposition Our Values Environmental, social and governance considerations are at the core of our business and are reflected in ENMAX’s value proposition to: SAFETY Nobody gets hurt – Deliver a stable, predictable and growing dividend – Enhance long-term value of the company – Provide industry leadership and corporate citizenship – Provide safe, reliable products, goods and services – Provide high standards of efficiency and customer service INTEGRITY Do what's right with courage and conviction ACCOUNTABILITY Own it – Provide alignment with City of Calgary economic, environmental and social goals Our Mission SERVICE O We power the potential of people, businesses and communities by safely and responsibly providing electricity and energy services in ways that matter to them today and tomorrow.
Act with others in mind TEAMWORK Together, we are better and stronger AGILITY Adapt and act INNOVATION Aim high and create possibilities £ ↓ £ ↑ 10 ENMAX 2021 ENVIRONMENTAL, SOCIAL & GOVERNANCE REPORT CEO LETTER ESG SCORECARD ABOUT ENMAX ENVIRONMENT SOCIAL GOVERNANCE TCFD APPENDICES Key statistics (as of December 31, 2021) WE OPERATE ACROSS THE ELECTRICITY VALUE CHAIN $609 million in adjusted EBITDA* in 2021 $8.6 billion in total assets in 2021 $62 million dividend declared to The City of Calgary in 2022 ENMAX ENERGY ENMAX POWER VERSANT POWER POWER GENERATION ENERGY RETAIL SERVICES TRANSMISSION & DISTRIBUTION TRANSMISSION & DISTRIBUTION 1,512 MW ** generation capacity, equity based ~700,000 residential, commercial, and industrial customers 1,089 km2 service territory in and around Calgary 26,900 km2 service territory in northern and eastern Maine 86% natural gas >40 municipalities 335 km of transmission lines 2,044 km of transmission lines 14% wind Provides: Electricity - Natural gas Solar power 8,629 km of distribution lines 9,977 km of distribution lines ~160,000 customers ALBERTA CALGARY MAINE * Adjusted earnings before interest, taxes, depreciation and amortization; Non-IFRS financial measure.
Refer to ENMAX's full 2021 Financial Report.
** Represents 2021 maximum capacity which includes increased generation at Shepard Energy Centre and the sale of District Energy Centre.
> 11 - ENMAX 2021 ENVIRONMENTAL , SOCIAL & GOVERNANCE REPORT CEO LETTER ESG SCORECARD ABOUT ENMAX ENVIRONMENT SOCIAL GOVERNANCE TCFD APPENDICES Where we operate ENMAX ENERGY Competitive power generation and energy retail business, providing electricity, natural gas and customer care services in Alberta.
ALBERTA ENMAX POWER CALGARY Regulated wires business that owns, operates and maintains the transmission and distribution system in and around Calgary.
MAINE VERSANT POWER Regulated wires business that owns, operates and maintains transmission and distribution, and also provides customer care services to residential, commercial and industrial customers in Maine.
O Crossfield Energy Centre (Hybrid Electric Gas Turbine) 5 natural gas power plants 4 operated, 1 non-operated 3 wind power generation facilities operated 1 non-operated 1 battery storage Balzac Facility Shepard Energy Centre O Calgary Energy Centre 1Д Cavalier Energy Centre McBride Lake Wind Farm Taber Wind Farm Kettles Hill Wind Farm 5 12 ENMAX 2021 ENVIRONMENTAL, SOCIAL & GOVERNANCE REPORT CEO LETTER ABOUT ENMAX ENVIRONMENT GOVERNANCE TCFD APPENDICES ESG SCORECARD About this report This report communicates the ESG initiatives and key metrics that demonstrate ENMAX's progress to date and our commitment to continual advancement.
- The terms ENMAX, our, we, us, and the organization, refer to the ENMAX group of companies unless otherwise noted.
- The data included in tables and charts in this report reflects the performance of our companies in Alberta (ENMAX Corporation, ENMAX Power, ENMAX Energy) and, unless otherwise noted, excludes Versant Power.
When data is available for Versant Power, it is provided separately and noted accordingly.
- Qualitative information about the operations and achievements of Versant Power is provided throughout the report and noted explicitly with "Versant Power" or "in Maine".
- Unless otherwise indicated, this report covers data and qualitative information for the year ended December 31, 2021.
When available, historical data is provided for four years.
- For all of our targets, the date stated indicates by year end of the stated year.
For example, completing an activity by 2022, means completion by the end of 2022.
- For our companies in Alberta, we report environmental and social performance for all assets over which we have operational control, which means we report 100 per cent of data related to environment, human resources, safety and business practices for assets we operate.
The only exception to this principle is in accounting for greenhouse gas (GHG) emissions which we report based on financial ownership (see next point).
- We report GHG emissions using guidance from the Greenhouse Gas Protocol, developed by the World Resources Institute and the World Business Council for Sustainable Development, and account for our GHG emissions based on financial ownership (equity share approach).
Note that in previous sustainability reports, we had reported 100 per cent of the GHG emissions from facilities which we operated.
Reporting under the equity approach means that we include ENMAX's proportional share of the emissions from our Shepard Energy Centre, 50 per cent from our Balzac facility, and GHG emissions associated with structured power agreements such as Energy Service Agreements where ENMAX is responsible for carbon compliance obligations.
Following this principle, our 2015 baseline for our net-zero target includes GHG emissions related to our Power Purchase Arrangements (PPAs).
GHG emissions for prior years have been restated under the equity share approach.
- Unless noted, data does not cover third-party service providers.
- Unless noted, financial data is in Canadian dollars and environmental data is in metric units.
- The accuracy of this report is of significant importance to our company.
Senior management, our internal auditors and relevant staff have reviewed key information and believe it is an accurate representation of our performance.
In some instances, estimates are made based on best-available information and records at the time of writing.
- See Forward-looking Information Advisory (on page 81) for information regarding estimates and other forward- looking statements contained in this report.
SOCIAL ALIGNING WITH ESG REPORTING STANDARDS We cross-reference our disclosures in this report to the following recognized standards: SASB page 77 TCFD page 62 GRI page 79 Read our caution regarding forward-looking statements on page 81.
13 ABOUT ENMAX ENVIRONMENT SOCIAL GOVERNANCE TCFD APPENDICES ENMAX 2021 ENVIRONMENTAL, SOCIAL & GOVERNANCE REPORT CEO LETTER Our approach to ESG We are committed to the highest level of accountability to our Shareholder (The City of Calgary), customers, employees and all Calgarians.
